ticker,company name,short name,industry,description,website,logo,ceo,exchange,market cap,sector,tag 1,tag 2,tag 3 
RHI,Robert Half International Inc.,Robert Half International,Employment Services,"Robert Half International Inc is a staffing agency providing specialized staffing and risk consulting services through divisions such as Accountemps, Robert Half Finance & Accounting, OfficeTeam, Robert Half Technology, and others.",http://www.roberthalf.com,RHI.png,Harold M. Messmer,New York Stock Exchange,7739174289,Industrials,Industrials,Staffing & Outsourcing Services,Employment Services 
MAN,ManpowerGroup,ManpowerGroup,Employment Services,"ManpowerGroup Inc is engaged in the employment services industry. It offers permanent, temporary and contract recruitment services; assessment and selection services; training and development services; outsourcing services, and among others.",http://www.manpowergroup.com,,Jonas Prising,New York Stock Exchange,4867684680,Industrials,Industrials,Staffing & Outsourcing Services,Employment Services 
NSP,Insperity Inc.,Insperity,Employment Services,Insperity Inc is engaged in providing human resources and business solutions designed to improve business performance. Its product offerings are provided through its Workforce Optimization and Workforce Synchronization solutions.,http://www.insperity.com,NSP.png,Paul J. Sarvadi,New York Stock Exchange,4514232718,Industrials,Industrials,Staffing & Outsourcing Services,Employment Services 
JOBS,51job Inc.,51job,Employment Services,51job Inc is a provider of integrated human resource services in China. It provides these services in two categories: Recruitment Advertising Services and Other Human Resource Related Services.,http://www.51job.com,JOBS.png,Rick Yan,Nasdaq Global Select,4422237024,Industrials,Industrials,Staffing & Outsourcing Services,Employment Services 
ASGN,ASGN Incorporated,ASGN Incorporated,Employment Services,"ASGN Inc, formerly On Assignment Inc provides skilled and professionals in the growing life sciences, healthcare, and technology sectors. The company's operating business segments are Apex and Oxford.",https://www.asgn.com,ASGN.png,Peter T. Dameris,New York Stock Exchange,3338588458,Industrials,Industrials,Staffing & Outsourcing Services,Employment Services 
KFY,Korn Ferry,Korn Ferry,Employment Services,"Korn/Ferry International is a management recruitment firm. It provides talent management solutions that help clients to attract, develop, retain and sustain their talent.",http://www.kornferry.com,KFY.png,Gary D. Burnison,New York Stock Exchange,2639357358,Industrials,Industrials,Staffing & Outsourcing Services,Employment Services 
TBI,TrueBlue Inc.,TrueBlue,Employment Services,"TrueBlue Inc is a provider of staffing and workforce-management solutions. It services are blue-collar staffing services including general labor, light industrial, skilled trades, aviation and transportation mechanics and technicians and drivers.",http://www.trueblue.com,TBI.png,A. Patrick Beharelle,New York Stock Exchange,990269484,Industrials,Industrials,Staffing & Outsourcing Services,Employment Services 
KELYA,Kelly Services Inc. Class A Common Stock,Kelly Services Common Stock,Employment Services,"Kelly Services Inc is a provider of workforce solutions and consulting and staffing services. The company assigns professional and technical employees in the fields of education, legal, health care, and creative services.",http://www.kellyservices.com,KELYA.png,George S. Corona,Nasdaq Global Select,892384805,Industrials,Industrials,Staffing & Outsourcing Services,Employment Services 
KFRC,Kforce Inc.,Kforce,Employment Services,Kforce Inc is a staffing solutions provider. It specializes in proving professional and technical staffing services to varied markets.,http://www.kforce.com,KFRC.png,David L. Dunkel,Nasdaq Global Select,871751651,Industrials,Industrials,Staffing & Outsourcing Services,Employment Services 
KELYB,Kelly Services Inc. Class B Common Stock,Kelly Services B Common Stock,Employment Services,"Kelly Services Inc is a provider of workforce solutions and consulting and staffing services. The company assigns professional and technical employees in the fields of education, legal, health care, and creative services.",http://www.kellyservices.com,KELYB.png,George S. Corona,Nasdaq Global Select,855461217,Industrials,Industrials,Staffing & Outsourcing Services,Employment Services 
HSII,Heidrick & Struggles International Inc.,Heidrick & Struggles International,Employment Services,"Heidrick & Struggles International Inc is an advisory firm providing executive search, leadership consulting and culture shaping services.",http://www.heidrick.com,HSII.png,Krishnan Rajagopalan,Nasdaq Global Select,622223648,Industrials,Industrials,Staffing & Outsourcing Services,Employment Services 
BBSI,Barrett Business Services Inc.,Barrett Business Services,Employment Services,Barrett Business Services Inc is a provider of staffing solutions in the United States. It conducts its business through two services; Professional Employer Service and Staffing.,http://www.barrettbusiness.com,BBSI.png,Michael L. Elich,Nasdaq Global Select,478073782,Industrials,Industrials,Staffing & Outsourcing Services,Employment Services 
CCRN,Cross Country Healthcare Inc.,Cross Country Healthcare,Employment Services,"Cross Country Healthcare Inc provides healthcare staffing, recruiting, and workforce solutions. The company operates business across three segments and mainly offers nurse and allied staffing, travel nurse, and branch-based local nurse in the US.",https://www.crosscountryhealthcare.com,,Kevin Clark,Nasdaq Global Select,354894686,Industrials,Industrials,Staffing & Outsourcing Services,Employment Services 
BGSF,BG Staffing Inc,BG Staffing,Employment Services,"BG Staffing Inc provides temporary staffing services in the U.S. in Multifamily, Professional, and Commercial. Its temporary staffing services consist of on-demand or short-term staffing assignments, contract staffing, & on-site management administration.",http://www.bgstaffing.com,BGSF.png,Beth A. Garvey,NYSE American,264104802,Industrials,Industrials,Staffing & Outsourcing Services,Employment Services 
DHX,DHI Group Inc.,DHI,Employment Services,"DHI Group Inc is a provider of data, insights and employment connections through its specialized services including technology and security clearance, financial services, energy, healthcare, and hospitality.",https://www.dhigroupinc.com,DHX.png,Art Zeile,New York Stock Exchange,102078574,Industrials,Industrials,Staffing & Outsourcing Services,Employment Services 
MHH,Mastech Digital Inc,Mastech Digital,Employment Services,Mastech Digital Inc is a provider of Information Technology (IT) staffing services. The Company recruit through Recruiting Centers located in the U.S. and India that deliver a full range of recruiting and sourcing services.,http://www.mastechdigital.com,MHH.png,Vivek Gupta,NYSE American,82378020,Industrials,Industrials,Staffing & Outsourcing Services,Employment Services 
VISI,Volt Information Sciences Inc.,Volt Information Sciences,Employment Services,"Volt Information Sciences Inc functions in the staffing services industry in the United States. Its main business involves personnel recruitment services, technology outsourcing and provision of infrastructure.",http://www.volt.com,VISI.png,Linda Perneau,NYSE American,80102093,Industrials,Industrials,Staffing & Outsourcing Services,Employment Services 
DLHC,DLH Holdings Corp.,DLH,Employment Services,DLH Holdings Corp is a a payroll staffing company. It provides services and solutions in two market areas: Healthcare Delivery Solutions and Logistics & Technical Services.,http://www.dlhcorp.com,DLHC.png,Zachary C. Parker,NASDAQ Capital Market,64634185,Industrials,Industrials,Staffing & Outsourcing Services,Employment Services 
HSON,Hudson Global Inc.,Hudson Global,Employment Services,"Hudson Global Inc is a staffing firm that provides permanent recruitment, contract consulting, legal eDiscovery, recruitment process outsourcing and talent management solutions. It also provides other recruitment and talent-related solutions.",http://www.hudson.com,,Jeffrey E. Eberwein,Nasdaq Global Select,47750556,Industrials,Industrials,Staffing & Outsourcing Services,Employment Services 
PIXY,ShiftPixy Inc.,ShiftPixy,Employment Services,ShiftPixy Inc is a provider of employment services solutions for businesses and workers in an environment in which shift or other part-time/temporary positions are performed.,http://www.shiftpixy.com,PIXY.png,Scott W. Absher,NASDAQ Capital Market,40284947,Industrials,Industrials,Staffing & Outsourcing Services,Employment Services 
JOB,GEE Group Inc.,GEE,Employment Services,"GEE Group Inc provides professional placement services throughout the United States. It specializes in the placement of information technology, engineering, and accounting professionals for direct hire and contract staffing.",http://www.geegroup.com,JOB.png,Derek E. Dewan,NYSE American,19832204,Industrials,Industrials,Staffing & Outsourcing Services,Employment Services 
CCNI,Command Center Inc.,Command Center,Employment Services,"Command Center Inc operates in the manual labor segment of the staffing industry. It provides services to the customers in the areas of light industrial, hospitality and event services.",http://www.commandonline.com,,Richard K. Coleman,NASDAQ Capital Market,19331188,Industrials,Industrials,Staffing & Outsourcing Services,Employment Services 
STAF,Staffing 360 Solutions Inc.,Staffing 360 Solutions,Employment Services,"Staffing 360 Solutions Inc is an international staffing company engaged in the acquisition of United States and United Kingdom based staffing companies. It pursues spectrum of staffing companies supporting accounting,IT engineering, administration.",http://www.staffing360solutions.com,STAF.png,Brendan Flood,NASDAQ Capital Market,13222537,Industrials,Industrials,Staffing & Outsourcing Services,Employment Services 
