ticker,company name,short name,industry,description,website,logo,ceo,exchange,market cap,sector,tag 1,tag 2,tag 3 
TLF,Tandy Leather Factory Inc.,Tandy Leather Factory,Manufacturing - Apparel & Furniture,"Tandy Leather Factory Inc is a retailer and wholesale distributor of leather and related products, including leather, leatherworking tools, buckles and adornments for belts, leather dyes and finishes, saddle and tack hardware, and do-it-yourself kits.",http://www.tandyleatherfactory.com,TLF.png,Janet Carr,NASDAQ Global Market,52178986,Consumer Cyclical,Consumer Cyclical,Footwear & Accessories,Manufacturing - Apparel & Furniture 
XELB,Xcel Brands Inc,Xcel Brands,Manufacturing - Apparel & Furniture,"Xcel Brands Inc is a media and brand management company engaged in the design, production, licensing, marketing, and direct to consumer sales of branded apparel, footwear, accessories, jewelry, home goods, and other consumer products.",http://www.xcelbrands.com,,Robert W. D'Loren,NASDAQ Global Market,23404206,Consumer Cyclical,Consumer Cyclical,Apparel Manufacturing,Manufacturing - Apparel & Furniture 
NVFY,Nova Lifestyle Inc,Nova Lifestyle,Manufacturing - Apparel & Furniture,"Nova Lifestyle Inc is a designer and lifestyle furniture company. It distributes and retails contemporary styled residential furniture. The firm's marketing and sales platform offer retail, online selection, and purchase fulfillment internationally.",http://www.novalifestyle.com,NVFY.png,Thanh H. Lam,NASDAQ Global Market,19080457,Consumer Cyclical,Consumer Cyclical,Home Furnishings & Fixtures,Manufacturing - Apparel & Furniture 
NAKD,Naked Brand Group Limited,Naked Brand Limited,Manufacturing - Apparel & Furniture,,https://www.nakedbrands.com,NAKD.png,Justin Davis-Rice,NASDAQ Capital Market,18228957,Consumer Cyclical,Consumer Cyclical,Apparel Manufacturing,Manufacturing - Apparel & Furniture 
FORD,Forward Industries Inc.,Forward Industries,Manufacturing - Apparel & Furniture,"Forward Industries Inc is engaged in the designing, marketing and distribution of protective solutions for hand held electronic devices. The Company's protective solutions include soft-sided carrying cases, bags, clips, hand straps and other accessories.",http://www.forwardindustries.com,FORD.png,Terence Wise,NASDAQ Capital Market,14491454,Consumer Cyclical,Consumer Cyclical,Footwear & Accessories,Manufacturing - Apparel & Furniture 
EFOI,Energy Focus Inc.,Energy Focus,Manufacturing - Apparel & Furniture,"Energy Focus Inc along with its subsidiaries is engaged in the design, development, manufacturing, marketing, and installation of lighting systems and solutions. Its product offerings include military maritime, globe lights, berth lights and others.",https://www.energyfocus.com,EFOI.png,Theodore L. Tewksbury,NASDAQ Capital Market,12319723,Consumer Cyclical,Consumer Cyclical,Home Furnishings & Fixtures,Manufacturing - Apparel & Furniture 
ICON,Iconix Brand Group Inc.,Iconix Brand,Manufacturing - Apparel & Furniture,"Iconix Brand Group Inc is a brand management company. It is engaged in licensing, marketing and providing trend direction for a portfolio of consumer brands. It operates through five segments: men's, women's, home, entertainment and international.",http://www.iconixbrand.com,ICON.png,Robert Galvin,Nasdaq Global Select,12121047,Consumer Cyclical,Consumer Cyclical,Apparel Manufacturing,Manufacturing - Apparel & Furniture 
KBSF,KBS Fashion Group Limited,KBS Fashion Limited,Manufacturing - Apparel & Furniture,"KBS Fashion Group Ltd is a casual menswear company in China. The company is engaged in designing, manufacturing, marketing, and selling of its fashion menswear, through network of stores.",http://www.kbsfashion.com,,Keyan Yan,NASDAQ Capital Market,8512859,Consumer Cyclical,Consumer Cyclical,Apparel Manufacturing,Manufacturing - Apparel & Furniture 
