ticker,company name,short name,industry,description,website,logo,ceo,exchange,market cap,sector,tag 1,tag 2,tag 3 
IP,International Paper Company,International Paper Company,Packaging & Containers,"International Paper Co produces and distributes printing paper, packaging, forest products, and chemical products. The company operates in three segments namely; Industrial Packaging, Printing Papers, and Global Cellulose Fibers.",http://www.internationalpaper.com,IP.png,Mark S. Sutton,New York Stock Exchange,18801421577,Consumer Cyclical,Consumer Cyclical,Packaging & Containers, 
BLL,Ball Corporation,Ball,Packaging & Containers,Ball Corp is the world's largest metal can manufacturer. The company primarily serves the North American food can market with its packaging products and the US defense industry by offering various components used in the space mission.,http://www.ball.com,BLL.png,John A. Hayes,New York Stock Exchange,17631158940,Consumer Cyclical,Consumer Cyclical,Packaging & Containers, 
WRK,Westrock Company,Westrock Company,Packaging & Containers,"WestRock Co provides paper and packaging solutions in consumer and corrugated markets. The Company offers corrugated container, paperboard, partitions and protective packaging, containerboard and beverage multipacks.",http://www.westrock.com,WRK.png,,New York Stock Exchange,9698552385,Consumer Cyclical,Consumer Cyclical,Packaging & Containers, 
PKG,Packaging Corporation of America,Packaging of America,Packaging & Containers,"Packaging Corp of America is a producer of container board and corrugated products in the US. Further, it also produces multi-color boxes and displays, as well as meat boxes and wax-coated boxes for the agricultural industry.",http://www.packagingcorp.com,PKG.png,Mark W. Kowlzan,New York Stock Exchange,8955508931,Consumer Cyclical,Consumer Cyclical,Packaging & Containers, 
CCK,Crown Holdings Inc.,Crown,Packaging & Containers,"Crown Holdings Inc is one of the world's largest producer of metal packaging products. The company manufactures beverage cans, metal food cans, and closures as well as aerosol cans. It operates mainly in US and Europe.",http://www.crowncork.com,CCK.png,Timothy J. Donahue,New York Stock Exchange,6885235205,Consumer Cyclical,Consumer Cyclical,Packaging & Containers, 
BERY,Berry Global Group Inc.,Berry Global,Packaging & Containers,"Berry Global Group Inc is a plastics packaging products manufacturing company. It operates three segments and sells containers, plastic drink cups, printed bags for food products, and baby diapers, feminine hygiene products, tapes, and plastic films.",http://www.berryglobal.com,BERY.png,Thomas E. Salmon,New York Stock Exchange,6438088383,Consumer Cyclical,Consumer Cyclical,Packaging & Containers, 
SEE,Sealed Air Corporation,Sealed Air,Packaging & Containers,"Sealed Air Corp is engaged in three reporting segments, Food care, Diversey Care and Product care. It mainly provides cleaning, sanitation, and housekeeping solutions to the food service industry.",http://www.sealedair.com,SEE.png,Edward L. Doheny,New York Stock Exchange,6372729286,Consumer Cyclical,Consumer Cyclical,Packaging & Containers, 
ATR,AptarGroup Inc.,AptarGroup,Packaging & Containers,"AptarGroup, Inc. is a solution provider of packaging delivery solutions for the beauty, personal care, home care, prescription drug, consumer health care, injectables, food and beverage markets.",http://www.aptar.com,ATR.png,Stephan Tanda,New York Stock Exchange,6271984690,Consumer Cyclical,Consumer Cyclical,Packaging & Containers, 
SON,Sonoco Products Company,Sonoco Products Company,Packaging & Containers,"Sonoco Products Co is a manufacturer of industrial and consumer packaging products and provides packaging services. It operates in Consumer Packaging, Paper and Industrial Converted Products, Display and Packaging, and Protective Solutions segments.",http://www.sonoco.com,SON.png,Robert C. Tiede,New York Stock Exchange,5779944865,Consumer Cyclical,Consumer Cyclical,Packaging & Containers, 
BMS,Bemis Company Inc.,Bemis Company,Packaging & Containers,Bemis Co Inc operates in the packaging industry. The company engages in the manufacture of packaging and pressure sensitive materials. Majority of the products are sold to the food industry. The United States packaging segment generates maximum revenue.,http://www.bemis.com,BMS.png,William F. Austen,New York Stock Exchange,4496310000,Consumer Cyclical,Consumer Cyclical,Packaging & Containers, 
GPK,Graphic Packaging Holding Company,Graphic Packaging Holding Company,Packaging & Containers,"Graphic Packaging Holding Co is a holding company engaged in providing paper-based packaging solutions to food, beverage and other consumer products companies. It is a producer of folding cartons in Europe, Americas and Asia Pacific.",http://www.graphicpkg.com,,Michael P. Doss,New York Stock Exchange,3679669748,Consumer Cyclical,Consumer Cyclical,Packaging & Containers, 
OI,Owens-Illinois Inc.,Owens-Illinois,Packaging & Containers,"Owens-Illinois Inc is a glass container manufacturer. The company is also a preferred partner for various food and beverage brands. It provides glass packaging for beer, wine, spirits, food, non-alcoholic beverages, cosmetics and pharmaceuticals.",http://www.o-i.com,OI.png,Andres Alberto Lopez,New York Stock Exchange,3203332513,Consumer Cyclical,Consumer Cyclical,Packaging & Containers, 
SLGN,Silgan Holdings Inc.,Silgan,Packaging & Containers,"Silgan Holdings Inc is a manufacturer of rigid packaging for shelf-stable food and other consumer goods products. Its products include steel and aluminum containers, metal, composite and plastic closures, custom designed plastic containers and others.",http://www.silganholdings.com,SLGN.png,Anthony J. Allott,Nasdaq Global Select,3136017352,Consumer Cyclical,Consumer Cyclical,Packaging & Containers, 
ARD,Ardagh Group S.A.,Ardagh S.A.,Packaging & Containers,"Ardagh Group SA supplies rigid packaging solutions including metal and glass containers for food and beverage markets. Its end users include beer, wine, spirits, soft drink, energy drinks, juices, flavored waters, food, seafood and nutrition industries.",http://www.ardaghgroup.com,ARD.png,Paul Coulson,New York Stock Exchange,2906490000,Consumer Cyclical,Consumer Cyclical,Packaging & Containers, 
GEF,Greif Inc. Class A,Greif,Packaging & Containers,"Greif Inc produces industrial packaging products with manufacturing facilities located in over many countries. Its products are steel, fibre and plastic drums, intermediate bulk containers, closure systems for industrial packaging and among others.",http://www.greif.com,GEF.png,Peter G. Watson,New York Stock Exchange,2264379583,Consumer Cyclical,Consumer Cyclical,Packaging & Containers, 
YETI,YETI Holdings Inc.,YETI,Packaging & Containers,,http://www.YETI.com,YETI.png,Matthew J. Reintjes,New York Stock Exchange,1490270598,Consumer Cyclical,Consumer Cyclical,Packaging & Containers, 
TUP,Tupperware Brands Corporation,Tupperware Brands,Packaging & Containers,"Tupperware Brands Corp is a direct selling consumer products company. It sells food preparation, storage, and serving products as well as cookware and microfiber textiles under the Tupperware brand name.",http://www.tupperwarebrands.com,TUP.png,Patricia A. Stitzel,New York Stock Exchange,1334031377,Consumer Cyclical,Consumer Cyclical,Packaging & Containers, 
GEF.B,Greif Inc. Corporation Class B,Greif B,Packaging & Containers,"Greif Inc produces industrial packaging products with manufacturing facilities located in over many countries. Its products are steel, fibre and plastic drums, intermediate bulk containers, closure systems for industrial packaging and among others.",http://www.greif.com,GEF.B.png,Peter G. Watson,New York Stock Exchange,995398470,Consumer Cyclical,Consumer Cyclical,Packaging & Containers, 
CYRX,CryoPort Inc.,CryoPort,Packaging & Containers,"CryoPort Inc provides cryogenic logistics solutions to the life sciences industry through its proprietary packaging, information technology, and cold chain logistics expertise. It offers logistics solutions for stem cells and CAR-T cells.",http://www.cryoport.com,CYRX.png,Jerrell W. Shelton,NASDAQ Capital Market,315399330,Consumer Cyclical,Consumer Cyclical,Packaging & Containers, 
UFPT,UFP Technologies Inc.,UFP,Packaging & Containers,UFP Technologies Inc is a U.S. based company designing and manufacturing various high-performance cushion packaging and specialty foam and plastic products for industrial and consumer products.,http://www.ufpt.com,UFPT.png,R. Jeffrey Bailly,NASDAQ Capital Market,236753677,Consumer Cyclical,Consumer Cyclical,Packaging & Containers, 
FFHL,Fuwei Films (Holdings) Co. Ltd.,Fuwei Films (Holdings) Co.,Packaging & Containers,"Fuwei Films (Holdings) Co Ltd along with its subsidiaries is engaged in the production and distribution of BOPET film, high quality plastic film widely used in packaging, imaging, electronics, electrical and magnetic products in China.",http://www.fuweiholdings.com,,Zengyong Wang,NASDAQ Capital Market,7184841,Consumer Cyclical,Consumer Cyclical,Packaging & Containers, 
