ticker,company name,short name,industry,description,website,logo,ceo,exchange,market cap,sector,tag 1,tag 2,tag 3 
AMZN,Amazon.com Inc.,Amazon.com,Retail - Apparel & Specialty,"Amazon.com Inc is an online retailer. The Company sells its products through the website which provides services, such as advertising services and co-branded credit card agreements. It also offers electronic devices like Kindle e-readers and Fire tablets.",http://www.amazon.com,AMZN.png,Jeffrey P. Bezos,Nasdaq Global Select,8.02E+11,Consumer Cyclical,Consumer Cyclical,Specialty Retail,Retail - Apparel & Specialty 
BABA,Alibaba Group Holding Limited,Alibaba Holding Limited,Retail - Apparel & Specialty,"Alibaba Group Holding Ltd is an online and mobile commerce company. It operates China's most popular online marketplaces such as Taobao (C2C), Tmall (B2C), and Juhuasuan. It also engages in advertising, digital media, cloud computing, and other.",http://www.alibabagroup.com,BABA.png,Yong Daniel Zhang,New York Stock Exchange,4.32E+11,Consumer Cyclical,Consumer Cyclical,Specialty Retail,Retail - Apparel & Specialty 
HD,Home Depot Inc. (The),Home Depot (The),Retail - Apparel & Specialty,"The Home Depot Inc is a home improvement specialty retailer. Its stores sell an assortment of building materials, home improvement and lawn and garden products and provide a number of services.",http://www.homedepot.com,HD.png,Craig A. Menear,New York Stock Exchange,2.11E+11,Consumer Cyclical,Consumer Cyclical,Home Improvement Stores,Retail - Apparel & Specialty 
TJX,TJX Companies Inc. (The),TJX Companies (The),Retail - Apparel & Specialty,"TJX Companies Inc is an off-price apparel and home fashions retailer in the United States and other countries. Its stores offer family apparel, including footwear and accessories, home fashions, such as home basics, accent furniture, lamps, among others.",http://www.tjx.com,TJX.png,Ernie L. Herrman,New York Stock Exchange,1.21E+11,Consumer Cyclical,Consumer Cyclical,Apparel Stores,Retail - Apparel & Specialty 
LOW,Lowe's Companies Inc.,Lowe's Companies,Retail - Apparel & Specialty,"Lowe's Companies Inc is a home-improvement products dealer. The firm's stores offer products and services for home decorating, maintenance, repair, and remodeling.",http://www.lowes.com,LOW.png,Marvin R. Ellison,New York Stock Exchange,78521165715,Consumer Cyclical,Consumer Cyclical,Home Improvement Stores,Retail - Apparel & Specialty 
JD,JD.com Inc.,JD.com,Retail - Apparel & Specialty,JD.com Inc is an online direct sales company in China. It acquires products from suppliers and sells them directly to its customers through its website and mobile applications.,http://www.jd.com,JD.png,Qiangdong Richard Liu,Nasdaq Global Select,36205744575,Consumer Cyclical,Technology,Internet Content & Information,Online Media 
ROST,Ross Stores Inc.,Ross Stores,Retail - Apparel & Specialty,"Ross Stores Inc is the off-price apparel and home fashion chains which is engaged in selling name-brand and designer apparel, accessories, footwear, and home fashions to middle-income consumers.",http://www.rossstores.com,ROST.png,Barbara Rentler,Nasdaq Global Select,34386936608,Consumer Cyclical,Consumer Cyclical,Apparel Stores,Retail - Apparel & Specialty 
PDD,Pinduoduo Inc.,Pinduoduo,Retail - Apparel & Specialty,,http://www.pinduoduo.com,,Zheng Huang,Nasdaq Global Select,34097663699,Consumer Cyclical,Consumer Cyclical,Specialty Retail,Retail - Apparel & Specialty 
EBAY,eBay Inc.,eBay,Retail - Apparel & Specialty,"eBay Inc is a commerce platform and provides online marketplace for sale of goods. Its marketplace platforms include its online marketplace located at www.ebay.com, its localized counterparts and the eBay mobile apps.",http://www.ebay.com,EBAY.png,Devin N. Wenig,Nasdaq Global Select,32066559808,Consumer Cyclical,Consumer Cyclical,Specialty Retail,Retail - Apparel & Specialty 
ORLY,O'Reilly Automotive Inc.,O'Reilly Automotive,Retail - Apparel & Specialty,"O'Reilly Automotive Inc acts as a seller of aftermarket automotive parts, tools, and accessories, serving professional and DIY (do-it-yourself) customers in the US.",http://www.oreillyauto.com,ORLY.png,Gregory D. Johnson,Nasdaq Global Select,28779089106,Consumer Cyclical,Consumer Cyclical,Specialty Retail,Retail - Apparel & Specialty 
AZO,AutoZone Inc.,AutoZone,Retail - Apparel & Specialty,"AutoZone Inc is a retailer and distributor of automotive replacement parts in the United States. The company's store sell a diverse range of essentials and auto parts for cars, sport utility vehicles, vans and light trucks.",http://www.autozone.com,AZO.png,William C. Rhodes,New York Stock Exchange,21914343880,Consumer Cyclical,Consumer Cyclical,Specialty Retail,Retail - Apparel & Specialty 
LULU,lululemon athletica inc.,lululemon athletica,Retail - Apparel & Specialty,Lululemon Athletica Inc is a designer and retailer of technical athletic apparel operating in North America and Australia. Its yoga-inspired apparel is marketed under the lululemon athletica and ivivva athletica brand names.,http://www.lululemon.com,LULU.png,Calvin McDonald,Nasdaq Global Select,19876487729,Consumer Cyclical,Consumer Cyclical,Apparel Stores,Retail - Apparel & Specialty 
ULTA,Ulta Beauty Inc.,Ulta Beauty,Retail - Apparel & Specialty,"Ulta Beauty Inc operates as a beauty retailer in the United States. It offers cosmetics, fragrance, skin, hair care products and salon services.",http://www.ulta.com,ULTA.png,Mary N. Dillon,Nasdaq Global Select,17303725182,Consumer Cyclical,Consumer Cyclical,Specialty Retail,Retail - Apparel & Specialty 
MELI,MercadoLibre Inc.,MercadoLibre,Retail - Apparel & Specialty,"MercadoLibre Inc is an e-commerce company. It hosts the online commerce platform in Latin America, which is focused on enabling e-commerce and its related services. The company generates most of its revenue from Brazil, Argentina, Venezuela, and Mexico.",http://www.mercadolibre.com,MELI.png,Marcos Galperin,Nasdaq Global Select,16820435862,Consumer Cyclical,Consumer Cyclical,Specialty Retail,Retail - Apparel & Specialty 
BBY,Best Buy Co. Inc.,Best Buy Co.,Retail - Apparel & Specialty,"Best Buy Co Inc is a U.S transnational consumer electronics company. Its products include tablets and computers, televisions, mobile phones, large and small appliances, entertainment products, digital imaging and related accessories.",http://www.bestbuy.com,BBY.png,Hubert Joly,New York Stock Exchange,15933503900,Consumer Cyclical,Consumer Cyclical,Specialty Retail,Retail - Apparel & Specialty 
GPC,Genuine Parts Company,Genuine Parts Company,Retail - Apparel & Specialty,"Genuine Parts Co sells automotive parts, industrial and electrical components, and office products. The company sells bearings, power transmission, hydraulic and other products to its commercial and retail customers.",http://www.genpt.com,GPC.png,Paul D. Donahue,New York Stock Exchange,14879922689,Consumer Cyclical,Consumer Cyclical,Specialty Retail,Retail - Apparel & Specialty 
AAP,Advance Auto Parts Inc W/I,Advance Auto Parts,Retail - Apparel & Specialty,"Advance Auto Parts Inc is an automotive aftermarket parts provider serving professional installers, DIY (do-it-yourself) customer and independently-owned operators.",https://shop.advanceautoparts.com,AAP.png,Thomas R. Greco,New York Stock Exchange,11761401561,Consumer Cyclical,Consumer Cyclical,Specialty Retail,Retail - Apparel & Specialty 
KSS,Kohl's Corporation,Kohl's,Retail - Apparel & Specialty,"Kohl's Corp is an American broadlines retailer. It operates department stores that sell moderately priced exclusive and national brand apparel, footwear, accessories, beauty and home products. The company also has an e-commerce platform.",https://www.kohlscorporation.com,KSS.png,Michelle D. Gass,New York Stock Exchange,11208156057,Consumer Cyclical,Consumer Cyclical,Department Stores,Retail - Apparel & Specialty 
TPR,Tapestry Inc.,Tapestry,Retail - Apparel & Specialty,"Tapestry Inc functions in the luxury goods industry. Its products include women's and men's bags, accessories, business cases, footwear, wearables and jewelry.",http://www.tapestry.com,TPR.png,Victor Luis,New York Stock Exchange,11186125291,Consumer Cyclical,Consumer Cyclical,Luxury Goods,Retail - Apparel & Specialty 
TSCO,Tractor Supply Company,Tractor Supply Company,Retail - Apparel & Specialty,Tractor Supply Co is an operator of rural lifestyle retail stores in the United States. It is engaged in supplying the needs of recreational farmers and ranchers as well as tradesmen and small businesses.,http://www.tractorsupplyco.com,TSCO.png,Gregory A. Sandfort,Nasdaq Global Select,10809126182,Consumer Cyclical,Consumer Cyclical,Specialty Retail,Retail - Apparel & Specialty 
TIF,Tiffany & Co.,Tiffany & Co.,Retail - Apparel & Specialty,"Tiffany & Co functions in the luxury goods market. As a retailer of jewelry, it sells timepieces, sterling silver goods, china, crystal and accessories.",http://www.tiffany.com,TIF.png,Alessandro Bogliolo,New York Stock Exchange,10786679688,Consumer Cyclical,Consumer Cyclical,Luxury Goods,Retail - Apparel & Specialty 
W,Wayfair Inc. Class A,Wayfair,Retail - Apparel & Specialty,"Wayfair Inc operates as an online destination for the home good products in the United States. It offers a range of furniture, décor, decorative accent, housewares, seasonal décor, and other home good products.",http://www.wayfair.com,W.png,Niraj Shah,New York Stock Exchange,10590042329,Consumer Cyclical,Consumer Cyclical,Specialty Retail,Retail - Apparel & Specialty 
QRTEB,Qurate Retail Inc. Series B Common Stock,Qurate Retail Series B Common Stock,Retail - Apparel & Specialty,"Qurate Retail Inc, formerly QVC Group is engaged in the video and on-line commerce industries in North America, Europe and Asia. It markets and sells consumer products by means of its televised shopping programs and through the Internet.",http://www.libertyinteractive.com,,Michael A. George,Nasdaq Global Select,9976859176,Consumer Cyclical,Consumer Cyclical,Specialty Retail,Retail - Apparel & Specialty 
QRTEA,Qurate Retail Inc. Series A Common Stock,Qurate Retail Series Common Stock,Retail - Apparel & Specialty,"Qurate Retail Inc, formerly QVC Group is engaged in the video and on-line commerce industries in North America, Europe and Asia. It markets and sells consumer products by means of its televised shopping programs and through the Internet.",http://www.libertyinteractive.com,,Michael A. George,Nasdaq Global Select,9866754199,Consumer Cyclical,Consumer Cyclical,Specialty Retail,Retail - Apparel & Specialty 
GPS,Gap Inc. (The),Gap (The),Retail - Apparel & Specialty,"Gap Inc is a global apparel and accessories retailer. The company offers products for men, women, and children under various brands such as Gap, Banana Republic, Old Navy, Athleta, and Intermix.",http://www.gapinc.com,,Arthur Peck,New York Stock Exchange,9642653997,Consumer Cyclical,Consumer Cyclical,Apparel Stores,Retail - Apparel & Specialty 
M,Macy's Inc,Macy's,Retail - Apparel & Specialty,"Macy's Inc is an omnichannel retailer. It sells merchandise, including men's, women's and children's apparel and accessories, cosmetics, home furnishings and other consumer goods.",http://www.macysinc.com,,Jeffrey Gennette,New York Stock Exchange,8007984266,Consumer Cyclical,Consumer Cyclical,Department Stores,Retail - Apparel & Specialty 
JWN,Nordstrom Inc.,Nordstrom,Retail - Apparel & Specialty,"Nordstrom Inc operates as a fashion specialty retailer in the United States. It sells its products through various channels, including Nordstrom full-line stores, Nordstrom Rack off-price stores, Last Chance clearance stores, and Jeffrey boutiques.",http://www.nordstrom.com,JWN.png,Erik B. Nordstrom,New York Stock Exchange,7698570983,Consumer Cyclical,Consumer Cyclical,Department Stores,Retail - Apparel & Specialty 
LB,L Brands Inc.,L Brands,Retail - Apparel & Specialty,"L Brands Inc is a women's intimate, personal care, and beauty retailer. The company through its retail outlets sells products under various brands such as Victoria's Secret, Pink, Bath and Body Works, La Senza, and Henri Bendel brands.",http://www.lb.com,LB.png,Leslie H. Wexner,New York Stock Exchange,7422872311,Consumer Cyclical,Consumer Cyclical,Apparel Stores,Retail - Apparel & Specialty 
KAR,KAR Auction Services Inc,KAR Auction Services,Retail - Apparel & Specialty,"KAR Auction Services Inc is a used car dealer with operations in US and Canada. The firm offers a total package for wholesale-used car transactions. Its services include financing, repossessions, repairs, transportation, warranty, and inventory services.",http://www.karauctionservices.com,,James P. Hallett,New York Stock Exchange,7162025773,Consumer Cyclical,Consumer Cyclical,Specialty Retail,Retail - Apparel & Specialty 
FIVE,Five Below Inc.,Five Below,Retail - Apparel & Specialty,"Five Below Inc is a retailer offering merchandise for teen and pre-teen customers. Its merchandise includes Style, Room, Sports, Tech, Crafts, Party, Candy and Now. It offers a broad range of discount merchandise at prices up to $5.",http://www.fivebelow.com,FIVE.png,Joel D. Anderson,Nasdaq Global Select,7070904550,Consumer Cyclical,Consumer Cyclical,Specialty Retail,Retail - Apparel & Specialty 
CBD,Companhia Brasileira de Distribuicao ADS,Companhia Brasileira de Distribuicao ADS,Retail - Apparel & Specialty,"Companhia Brasileira De Distribuicao is a Brazilian retail and distribution group. It operates in the food retailing, clothing, home appliances, electronics and other products segment through its chain of hypermarkets, supermarkets, and department stores.",http://www.gpari.com.br,,Ronaldo Iabrudi Dos Santos Pereira,New York Stock Exchange,6985246740,Consumer Cyclical,Consumer Cyclical,Department Stores,Retail - Apparel & Specialty 
ETSY,Etsy Inc.,Etsy,Retail - Apparel & Specialty,"Etsy Inc operates a marketplace where people around the world connect, both online and offline, to make, sell and buy goods.",https://www.etsy.com,ETSY.png,Josh Silverman,Nasdaq Global Select,6593982754,Consumer Cyclical,Consumer Cyclical,Specialty Retail,Retail - Apparel & Specialty 
FTCH,Farfetch Limited Class A,Farfetch Limited,Retail - Apparel & Specialty,,https://aboutfarfetch.com,FTCH.png,Jose Neves,New York Stock Exchange,5634291455,Consumer Cyclical,Consumer Cyclical,Specialty Retail,Retail - Apparel & Specialty 
VIPS,Vipshop Holdings Limited American Depositary Shares each representing two,Vipshop Limited American Depositary Shares each representing two,Retail - Apparel & Specialty,"Vipshop Holdings Ltd is an online discount retailer for brands in China. It offers branded products to consumers in China through flash sales on its vipshop.com, vip.com and lefeng.com websites.",http://www.vip.com,,Ya Eric Shen,New York Stock Exchange,5167800015,Consumer Cyclical,Consumer Cyclical,Specialty Retail,Retail - Apparel & Specialty 
WSM,Williams-Sonoma Inc. (DE),Williams-Sonoma (DE),Retail - Apparel & Specialty,Williams-Sonoma Inc is a multi-channel specialty retailer of home furnishings in the United States and Canada. Its segments include e-commerce and retail.,http://www.williams-sonomainc.com,WSM.png,Laura J. Alber,New York Stock Exchange,4447014712,Consumer Cyclical,Consumer Cyclical,Specialty Retail,Retail - Apparel & Specialty 
AEO,American Eagle Outfitters Inc.,American Eagle Outfitters,Retail - Apparel & Specialty,"American Eagle Outfitters is a retailer of apparel and accessories that also offers personal care products. It sells its products in stores as well as online. It operates stores in the USA, Canada, Mexico, Hong Kong, China and the UK.",http://www.ae.com,AEO.png,Jay L. Schottenstein,New York Stock Exchange,3758005690,Consumer Cyclical,Consumer Cyclical,Apparel Stores,Retail - Apparel & Specialty 
BJ,BJ's Wholesale Club Holdings Inc.,BJ's Wholesale Club,Retail - Apparel & Specialty,,https://www.bjs.com,BJ.png,Christopher J. Baldwin,New York Stock Exchange,3652217777,Consumer Cyclical,Consumer Cyclical,Specialty Retail,Retail - Apparel & Specialty 
DKS,Dick's Sporting Goods Inc,Dick's Sporting Goods,Retail - Apparel & Specialty,"Dick's Sporting Goods Inc is sporting goods retailer offering an extensive assortment of authentic, high-quality sports equipment, apparel, footwear and accessories through associates, in-store services and unique specialty shop-in-shops.",http://www.dicks.com,DKS.png,Edward W. Stack,New York Stock Exchange,3492702250,Consumer Cyclical,Consumer Cyclical,Specialty Retail,Retail - Apparel & Specialty 
URBN,Urban Outfitters Inc.,Urban Outfitters,Retail - Apparel & Specialty,"Urban Outfitters Inc is a lifestyle specialty retail company that operates under the Urban Outfitters, Anthropologie, Free People, Terrain and Bhldn brands. It also operates a Wholesale segment under the Free People brand.",http://www.urbn.com,URBN.png,Richard A. Hayne,Nasdaq Global Select,3364897767,Consumer Cyclical,Consumer Cyclical,Apparel Stores,Retail - Apparel & Specialty 
FND,Floor & Decor Holdings Inc.,Floor & Decor,Retail - Apparel & Specialty,"Floor & Decor Holdings Inc is a specialty retailer of hard surface flooring and related accessories. It offers tile, wood, laminate and natural stone flooring along with decorative and installation accessories.",https://www.flooranddecor.com,FND.png,Thomas V. Taylor,New York Stock Exchange,3259520246,Consumer Cyclical,Consumer Cyclical,Home Improvement Stores,Retail - Apparel & Specialty 
RH,RH,RH,Retail - Apparel & Specialty,"RH, formerly Restoration Hardware Holdings Inc is a luxury brand in the home furnishings marketplace offering furniture, lighting, textiles, outdoor and garden products. It offers collections through its retail galleries, source books and websites.",http://www.restorationhardware.com,RH.png,Gary G. Friedman,New York Stock Exchange,2963908728,Consumer Cyclical,Consumer Cyclical,Specialty Retail,Retail - Apparel & Specialty 
EYE,National Vision Holdings Inc.,National Vision,Retail - Apparel & Specialty,"National Vision Holdings Inc is an optical retailers in the United States. Its brands include Eyeglass World, Vision Centre, Vista Optical, among others.",http://www.nationalvision.com,EYE.png,L. Reade Fahs,Nasdaq Global Select,2434533539,Consumer Cyclical,Consumer Cyclical,Specialty Retail,Retail - Apparel & Specialty 
MUSA,Murphy USA Inc.,Murphy USA,Retail - Apparel & Specialty,Murphy USA Inc. is engaged in the marketing of retail motor fuel products and convenience merchandise through a chain of retail stores in the United States.,http://www.murphyusa.com,MUSA.png,R. Andrew Clyde,New York Stock Exchange,2420256455,Consumer Cyclical,Consumer Cyclical,Specialty Retail,Retail - Apparel & Specialty 
SBH,Sally Beauty Holdings Inc. (Name to be changed from Holdings Inc.),Sally Beauty (Name to be changed from Inc.),Retail - Apparel & Specialty,"Sally Beauty Holdings Inc is a specialty retailer and distributor of professional beauty products with operations in North America, South America and Europe.",http://www.sallybeautyholdings.com,,Christian A. Brickman,New York Stock Exchange,2243325701,Consumer Cyclical,Consumer Cyclical,Specialty Retail,Retail - Apparel & Specialty 
SFIX,Stitch Fix Inc.,Stitch Fix,Retail - Apparel & Specialty,"Stitch Fix Inc offers personal style service for men and women. It delivers various product types, including denim, dresses, blouses, skirts, shoes, jewelry and handbags and sells merchandise across a various range of price points.",https://www.stitchfix.com,SFIX.png,Katrina Lake,Nasdaq Global Select,2219697132,Consumer Cyclical,Consumer Cyclical,Specialty Retail,Retail - Apparel & Specialty 
MIK,The Michaels Companies Inc.,The Michaels Companies,Retail - Apparel & Specialty,"The Michaels Companies Inc owns and operates a chain of specialty retail stores in 49 states and Canada featuring arts, crafts, framing, floral, home decor, seasonal merchandise for the hobbyist and do-it-yourself home decorator.",http://www.michaels.com,MIK.png,Carl Rubin,Nasdaq Global Select,2188012131,Consumer Cyclical,Consumer Cyclical,Specialty Retail,Retail - Apparel & Specialty 
DSW,DSW Inc.,DSW,Retail - Apparel & Specialty,DSW Inc is a retailer of footwear and accessories. It sells branded footwear through its network of departmental stores located nationwide. The company also operates leased shoe departments.,http://www.dswinc.com,DSW.png,Roger L. Rawlins,New York Stock Exchange,2144523591,Consumer Cyclical,Consumer Cyclical,Apparel Stores,Retail - Apparel & Specialty 
BBBY,Bed Bath & Beyond Inc.,Bed Bath & Beyond,Retail - Apparel & Specialty,"Bed Bath & Beyond Inc operates a chain of retail stores. It operates under the names Bed Bath & Beyond, Christmas Tree Shops and Harmon and Harmon Face Values.",http://www.bedbathandbeyond.com,BBBY.png,Steven H. Temares,Nasdaq Global Select,2086831837,Consumer Cyclical,Consumer Cyclical,Specialty Retail,Retail - Apparel & Specialty 
BZUN,Baozun Inc.,Baozun,Retail - Apparel & Specialty,"Baozun Inc provides its customers with end-to-end e-commerce solutions including the sales of apparel, home & electronic products, online store design, visual merchandising & marketing, online operations, customer service, warehousing & order fulfillment.",http://www.baozun.com,,Vincent Wenbin Qiu,Nasdaq Global Select,2049123607,Consumer Cyclical,Consumer Cyclical,Specialty Retail,Retail - Apparel & Specialty 
BID,Sotheby's,Sotheby's,Retail - Apparel & Specialty,"Sothebys is a global art business company. It conducts auctions and private sales of fine art, antiques and decorative art, jewelry, and collectibles.",http://www.sothebys.com,BID.png,Thomas S. Smith,New York Stock Exchange,1891415479,Consumer Cyclical,Consumer Cyclical,Specialty Retail,Retail - Apparel & Specialty 
MOGU,MOGU Inc. American Depositary Shares (each representing 25 Class A),MOGU American Depositary Shares (each representing 25 A),Retail - Apparel & Specialty,,http://www.mogu-inc.com,MOGU.png,Qi Chen,New York Stock Exchange,1848232324,Consumer Cyclical,Consumer Cyclical,Specialty Retail,Retail - Apparel & Specialty 
DDS,Dillard's Inc.,Dillard's,Retail - Apparel & Specialty,"Dillard's Inc is an American fashion apparel, cosmetics and home furnishings retailer. The company also operates a general contracting construction company engaged in constructing and remodeling stores of the company.",http://www.dillards.com,DDS.png,William T. Dillard,New York Stock Exchange,1772614998,Consumer Cyclical,Consumer Cyclical,Department Stores,Retail - Apparel & Specialty 
ODP,Office Depot Inc.,Office Depot,Retail - Apparel & Specialty,"Office Depot Inc is a supplier of office products and services. It offers products including office supplies, paper, ink, and tone, cleaning chemical and equipment's, monitors and equipment's, computers and tablets, office appliances, and school supplies.",http://www.officedepot.com,,Gerry P. Smith,Nasdaq Global Select,1644329470,Consumer Cyclical,Consumer Cyclical,Specialty Retail,Retail - Apparel & Specialty 
GES,Guess? Inc.,Guess?,Retail - Apparel & Specialty,"Guess? Inc designs, markets, distributes and licenses a lifestyle collection of contemporary apparel and accessories for men, women and children that reflects the American lifestyle and European fashion sensibilities.",http://www.guess.com,GES.png,Maurice Marciano / Victor Herrero Amigo,New York Stock Exchange,1589982590,Consumer Cyclical,Consumer Cyclical,Apparel Stores,Retail - Apparel & Specialty 
MED,MEDIFAST INC,MEDIFAST,Retail - Apparel & Specialty,"Medifast Inc is a health products manufacturer in the United States. It sells products such as meal replacements, snacks, hydration products and vitamins mainly through an online platform.",http://www.medifastdiet.com,MED.png,Daniel R. Chard,New York Stock Exchange,1540788497,Consumer Cyclical,Consumer Cyclical,Specialty Retail,Retail - Apparel & Specialty 
PLCE,Children's Place Inc. (The),Children's Place (The),Retail - Apparel & Specialty,"Children's Place Inc is an apparel retailer that operates stores in North America and sells through its website and wholesale. It designs, contracts to manufacture, and sells merchandise under the brand names The Children's Place, Place and Baby Place.",http://www.childrensplace.com,PLCE.png,Jane Elfers,Nasdaq Global Select,1512057309,Consumer Cyclical,Consumer Cyclical,Apparel Stores,Retail - Apparel & Specialty 
HOME,At Home Group Inc.,At Home,Retail - Apparel & Specialty,"At Home Group Inc is a home decor superstore. The company is engaged in providing assortment of products for every room, in every style at everyday low prices.",http://www.athome.com,HOME.png,Lewis L. Bird,New York Stock Exchange,1474197437,Consumer Cyclical,Consumer Cyclical,Specialty Retail,Retail - Apparel & Specialty 
ANF,Abercrombie & Fitch Company,Abercrombie & Fitch Company,Retail - Apparel & Specialty,"Abercrombie & Fitch Co is a retailer that sells apparel, personal care products and accessories for men, women and kids under Abercrombie & Fitch, Abercrombie kids, and Hollister brands. It operates online stores as well as direct-to-consumer operations.",http://www.abercrombie.com,ANF.png,Fran Horowitz-Bonadies,New York Stock Exchange,1443324000,Consumer Cyclical,Consumer Cyclical,Apparel Stores,Retail - Apparel & Specialty 
SIG,Signet Jewelers Limited,Signet Jewelers Limited,Retail - Apparel & Specialty,"Signet Jewelers Ltd is a retailer of diamond jewelry. It operates jewelry stores in malls and off-mall locations in the US under national brands including Kay, Kay Jewelers Outlet, Jared and Jared Vault, as well as a type of mall-based regional brands.",http://www.signetjewelers.com,SIG.png,Virginia C. Drosos,New York Stock Exchange,1272888591,Consumer Cyclical,Consumer Cyclical,Luxury Goods,Retail - Apparel & Specialty 
