ticker,company name,short name,industry,description,website,logo,ceo,exchange,market cap,sector,tag 1,tag 2,tag 3 
HUD,Hudson Ltd. Class A,Hudson,Retail - Apparel & Specialty,"Hudson Ltd is a travel retailer in North America. The company operates Hudson News, Hudson Booksellers, cafes, specialty retail and duty-free shops in airports and transportation terminals in the United States and Canada.",http://www.hudsongroup.com,HUD.png,Joseph DiDomizio,New York Stock Exchange,1238723361,Consumer Cyclical,Consumer Cyclical,Specialty Retail,Retail - Apparel & Specialty 
GME,GameStop Corporation,GameStop,Retail - Apparel & Specialty,"GameStop Corp is an multichannel video game retailer. It sells new and pre-owned video game hardware, physical and digital video game software and accessories through GameStop, EB Games and Micromania stores.",http://www.gamestopcorp.com,GME.png,,New York Stock Exchange,1159371044,Consumer Cyclical,Consumer Cyclical,Specialty Retail,Retail - Apparel & Specialty 
FLWS,1-800 FLOWERS.COM Inc.,1-800 FLOWERS.COM,Retail - Apparel & Specialty,"1-800-Flowers.com Inc is a U.S. based provider of gourmet food and gift baskets, consumer floral, and BloomNet wire service.",http://www.1800flowers.com,FLWS.png,Christopher G. McCann,Nasdaq Global Select,1110285818,Consumer Cyclical,Consumer Cyclical,Specialty Retail,Retail - Apparel & Specialty 
PRTY,Party City Holdco Inc.,Party City Holdco,Retail - Apparel & Specialty,"Party City Holdco Inc is a party goods retailer in North America. It designs, manufactures, contracts for manufacture and distributes party goods, including paper and plastic tableware, metallic and latex balloons, accessories, novelties and among others.",http://www.partycity.com,PRTY.png,James M. Harrison,New York Stock Exchange,1102961129,Consumer Cyclical,Consumer Cyclical,Specialty Retail,Retail - Apparel & Specialty 
GCO,Genesco Inc.,Genesco,Retail - Apparel & Specialty,"Genesco Inc is a specialty retailer, which is engaged in designing, sourcing, marketing and distribution of footwear, apparel and accessories through retail stores.",http://www.genesco.com,GCO.png,Robert J. Dennis,New York Stock Exchange,923606963,Consumer Cyclical,Consumer Cyclical,Apparel Stores,Retail - Apparel & Specialty 
SYX,Systemax Inc.,Systemax,Retail - Apparel & Specialty,"Systemax Inc is direct marketer of brand name and private label products including industrial, material handling and supplies, computer equipment and related accessories, technology supplies and consumer electronics.",http://www.systemax.com,SYX.png,Lawrence P. Reinhold,New York Stock Exchange,869651411,Consumer Cyclical,Consumer Cyclical,Specialty Retail,Retail - Apparel & Specialty 
BKE,Buckle Inc. (The),Buckle (The),Retail - Apparel & Specialty,"Buckle, Inc. is a retailer of casual apparel, footwear, and accessories for fashion conscious young men and women. It operates 468 stores located in 44 states throughout the continental United States.",http://www.buckle.com,BKE.png,Dennis H. Nelson,New York Stock Exchange,857814563,Consumer Cyclical,Consumer Cyclical,Apparel Stores,Retail - Apparel & Specialty 
DLTH,Duluth Holdings Inc.,Duluth,Retail - Apparel & Specialty,"Duluth Holdings Inc is an apparel company. Its products comprise of shirts, pants, and casual wear under brands like Alaskan Hardgear, Armachillo, Ballroom, Buck Naked, Cab Commander, Crouch Gusset, Dry on the Fly and Duluth Trading company.",http://www.duluthtrading.com,DLTH.png,Stephanie L. Pugliese,Nasdaq Global Select,757784656,Consumer Cyclical,Consumer Cyclical,Apparel Stores,Retail - Apparel & Specialty 
MOV,Movado Group Inc.,Movado,Retail - Apparel & Specialty,"Movado Group Inc designs, sources, markets and distributes fine watches. Its brands include Coach Watches, Concord, Ebel, ESQ Movado, Scuderia Ferrari Watches, HUGO BOSS Watches, Juicy Couture Watches, Lacoste Watches, Movado, and Tommy Hilfiger Watches.",http://www.movadogroup.com,MOV.png,Efraim Grinberg,New York Stock Exchange,743224904,Consumer Cyclical,Consumer Cyclical,Luxury Goods,Retail - Apparel & Specialty 
CHS,Chico's FAS Inc.,Chico's FAS,Retail - Apparel & Specialty,"Chico's FAS Inc is an apparel retailer of women's private branded clothing and accessories through products through retail stores, catalog and via Internet. The brands include Chico's, White House/Black Market, Soma Intimates, and Boston Proper.",http://www.chicosfas.com,CHS.png,Shelley G. Broader,New York Stock Exchange,739320101,Consumer Cyclical,Consumer Cyclical,Apparel Stores,Retail - Apparel & Specialty 
CONN,Conn's Inc.,Conn's,Retail - Apparel & Specialty,Conn's Inc is a holding company engaged in specialty retail. It is a specialty retailer that offers branded consumer goods and related services and also credit solutions for consumers. The firm operates its business through retail stores and website.,http://www.conns.com,CONN.png,Norman L. Miller,Nasdaq Global Select,661527695,Consumer Cyclical,Consumer Cyclical,Specialty Retail,Retail - Apparel & Specialty 
BOOT,Boot Barn Holdings Inc.,Boot Barn,Retail - Apparel & Specialty,Boot Barn Holdings Inc operates specialty retail stores that sell western and work boots and related apparel and accessories. The Company operates retail locations throughout the U.S. and sells its merchandise via the Internet.,http://www.bootbarn.com,BOOT.png,James G. Conroy,New York Stock Exchange,660654877,Consumer Cyclical,Consumer Cyclical,Apparel Stores,Retail - Apparel & Specialty 
TLRD,Tailored Brands Inc.,Tailored Brands,Retail - Apparel & Specialty,Tailored Brands Inc is a retailer of men's suits and a provider of tuxedo rental product in the United States and Canada.,http://www.tailoredbrands.com,TLRD.png,,New York Stock Exchange,643230919,Consumer Cyclical,Consumer Cyclical,Apparel Stores,Retail - Apparel & Specialty 
WINA,Winmark Corporation,Winmark,Retail - Apparel & Specialty,"Winmark Corp is a franchisor of retail store concepts that buy, sell, trade and consign merchandise. Additionally, it operates a small-ticket financing business.",http://www.winmarkcorporation.com,WINA.png,Brett D. Heffes,NASDAQ Global Market,615921772,Consumer Cyclical,Consumer Cyclical,Specialty Retail,Retail - Apparel & Specialty 
ZUMZ,Zumiez Inc.,Zumiez,Retail - Apparel & Specialty,"Zumiez Inc is a multi-channel specialty retailer. It is engaged in the retail sales of apparel, footwear, accessories and hardgoods for young men and women.",http://www.zumiez.com,ZUMZ.png,Richard M. Brooks,Nasdaq Global Select,615036827,Consumer Cyclical,Consumer Cyclical,Specialty Retail,Retail - Apparel & Specialty 
OSTK,Overstock.com Inc.,Overstock.com,Retail - Apparel & Specialty,"Overstock.com Inc is an online retailer which provides products and services through websites. It offers a broad range of products, including furniture and home decor, apparel and accessories, books, electronics, and other items.",http://www.overstock.com,,Patrick M. Byrne,NASDAQ Global Market,602738719,Consumer Cyclical,Consumer Cyclical,Specialty Retail,Retail - Apparel & Specialty 
LE,Lands' End Inc.,Lands' End,Retail - Apparel & Specialty,"Lands' End Inc is a multi-channel retailer of casual clothing, accessories and footwear, as well as home products. The Company offers products through catalogs, landsend.com, and operates in two segments; Direct and Retail.",http://www.landsend.com,LE.png,Jerome Griffith,NASDAQ Capital Market,576910490,Consumer Cyclical,Consumer Cyclical,Specialty Retail,Retail - Apparel & Specialty 
SCVL,Shoe Carnival Inc.,Shoe Carnival,Retail - Apparel & Specialty,"Shoe Carnival Inc is a family footwear retailer that offers a range of moderately priced dress, casual and athletic footwear for men, women and children. Its store has several brands; Nike and Skechers contributing the majority portion.",http://www.shoecarnival.com,SCVL.png,Clifton E. Sifford,Nasdaq Global Select,559106757,Consumer Cyclical,Consumer Cyclical,Apparel Stores,Retail - Apparel & Specialty 
ASNA,Ascena Retail Group Inc.,Ascena Retail,Retail - Apparel & Specialty,"Ascena Retail Group Inc, through its subsidiaries, operates as a specialty retailer of apparel for women and tween girls and boys. The Company offers apparel, accessories, footwear, and lifestyle products, such as bedroom furnishings and electronics.",http://www.ascenaretail.com,,David R. Jaffe,Nasdaq Global Select,505439122,Consumer Cyclical,Consumer Cyclical,Apparel Stores,Retail - Apparel & Specialty 
SECO,Secoo Holding Limited,Secoo Holding Limited,Retail - Apparel & Specialty,"Secoo Holding Ltd operates Online-Offline shopping platform in China. It operates as an online retailer in China, with website secoo.com, mobile APP and SECOO experience centers.",http://www.secoo.com,,Richard Rixue Li,NASDAQ Global Market,434111599,Consumer Cyclical,Consumer Cyclical,Specialty Retail,Retail - Apparel & Specialty 
BKS,Barnes & Noble Inc.,Barnes & Noble,Retail - Apparel & Specialty,"Barnes & Noble Inc is a bookseller, content, and a commerce company providing customers access to trade books, textbooks, magazines, newspapers and other content across its multi-channel distribution platform. Its segments are B&N Retail and NOOK.",http://www.barnesandnobleinc.com,BKS.png,Demos Parneros,New York Stock Exchange,427894381,Consumer Cyclical,Consumer Cyclical,Specialty Retail,Retail - Apparel & Specialty 
HVT,Haverty Furniture Companies Inc.,Haverty Furniture Companies,Retail - Apparel & Specialty,"Haverty Furniture Companies Inc is a retailer of residential furniture and accessories. It sells home furnishings in its retail stores and via its website and offers mattresses products such as Sealy, Serta, Stearns & Foster, and Tempur-Pedic.",http://www.havertys.com,HVT.png,Clarence H. Smith,New York Stock Exchange,426815350,Consumer Cyclical,Consumer Cyclical,Home Improvement Stores,Retail - Apparel & Specialty 
JCP,J.C. Penney Company Inc.,J.C. Penney Company,Retail - Apparel & Specialty,JC Penney Co Inc is an American omnichannel retailer. The company sells merchandise and services to consumers through department stores and its own website.,http://www.jcpenney.com,JCP.png,Jill A. Soltau,New York Stock Exchange,424211409,Consumer Cyclical,Consumer Cyclical,Department Stores,Retail - Apparel & Specialty 
HZO,MarineMax Inc. (FL),MarineMax (FL),Retail - Apparel & Specialty,"MarineMax Inc is a recreational boat and yacht dealer in the United States. The company offers new and used recreational boats and related marine products, including engines, trailers, parts, and accessories.",http://www.marinemax.com,HZO.png,William Brett McGill,New York Stock Exchange,416985031,Consumer Cyclical,Consumer Cyclical,Specialty Retail,Retail - Apparel & Specialty 
TLYS,Tilly's Inc.,Tilly's,Retail - Apparel & Specialty,"Tilly's Inc is US based company works as a specialty retailer of casual apparel, footwear and accessories for young men, young women, boys and girls. It offers an unparalleled selection of relevant brands, styles, colors, sizes and price points.",http://www.tillys.com,TLYS.png,Edmond S. Thomas,New York Stock Exchange,378527142,Consumer Cyclical,Consumer Cyclical,Apparel Stores,Retail - Apparel & Specialty 
TTS,Tile Shop Hldgs Inc.,Tile Shop Hldgs,Retail - Apparel & Specialty,"Tile Shop Holdings Inc is a retailer of manufactured and natural stone tiles, setting and maintenance materials, and related accessories. Its products include natural stone, ceramic, porcelain, glass, and metal tiles.",http://www.tileshop.com,TTS.png,Cabell H. Lolmaugh,Nasdaq Global Select,375120457,Consumer Cyclical,Consumer Cyclical,Home Improvement Stores,Retail - Apparel & Specialty 
EXPR,Express Inc.,Express,Retail - Apparel & Specialty,"Express, Inc. is a specialty retailer company in apparel and related. It serves both both women's and men's merchandise. The company operates in Express brick-and-mortar retail stores and e-commerce operations.",http://www.express.com,EXPR.png,Matthew C. Moellering,New York Stock Exchange,367998620,Consumer Cyclical,Consumer Cyclical,Apparel Stores,Retail - Apparel & Specialty 
TCS,Container Store (The),Container Store (The),Retail - Apparel & Specialty,The Container Store Group Inc a retailer of storage & organization products in USA. Its operates in two segment: The Container store and Elfa.,http://www.containerstore.com,TCS.png,Melissa Reiff,New York Stock Exchange,367338710,Consumer Cyclical,Consumer Cyclical,Specialty Retail,Retail - Apparel & Specialty 
JMEI,Jumei International Holding Limited American Depositary Shares each representing one Class A,Jumei International Holding Limited American Depositary Shares each representing one,Retail - Apparel & Specialty,"Jumei International Holding Ltd is an online retailer of beauty products. The product category includes cosmetics, skin care, cosmetic applicators, fragrance and body care.",http://www.jumei.com,,Leo Ou Chen,New York Stock Exchange,367217468,Consumer Cyclical,Consumer Cyclical,Specialty Retail,Retail - Apparel & Specialty 
CATO,Cato Corporation (The) Class A,Cato (The),Retail - Apparel & Specialty,Cato Corp is a fashion specialty retailer. The Company operates women's fashion specialty retail stores in the southeastern United States under two segment: the operation of a fashion specialty stores segment and a credit card segment.,http://www.catocorp.com,CATO.png,John P. Derham Cato,New York Stock Exchange,364452226,Consumer Cyclical,Consumer Cyclical,Apparel Stores,Retail - Apparel & Specialty 
LL,Lumber Liquidators Holdings Inc,Lumber Liquidators,Retail - Apparel & Specialty,"Lumber Liquidators Holdings Inc is a retailer of hardwood flooring in North America. Its products include foreign and domestic hardwood species, engineered hardwood, laminate, resilient vinyl, bamboo, and cork flooring.",http://www.lumberliquidators.com,LL.png,Dennis R. Knowles,New York Stock Exchange,332567979,Consumer Cyclical,Consumer Cyclical,Home Improvement Stores,Retail - Apparel & Specialty 
ZAGG,ZAGG Inc,ZAGG,Retail - Apparel & Specialty,"Zagg Inc designs, produces, and distributes professional and premium product solutions for mobile devices. It offers screen protection, keyboards for tablet computers and mobile devices, keyboard cases, earbuds, and mobile power solutions.",http://www.zagg.com,ZAGG.png,Chris Ahern,Nasdaq Global Select,331016762,Consumer Cyclical,Consumer Cyclical,Specialty Retail,Retail - Apparel & Specialty 
HIBB,Hibbett Sports Inc.,Hibbett Sports,Retail - Apparel & Specialty,"Hibbett Sports Inc is a United States-based operator of sporting goods retail stores in small to mid-sized markets mainly in the Southeast, Southwest, Mid-Atlantic and the Midwest.",http://www.hibbett.com,HIBB.png,Jeffry O. Rosenthal,Nasdaq Global Select,302993850,Consumer Cyclical,Consumer Cyclical,Specialty Retail,Retail - Apparel & Specialty 
LQDT,Liquidity Services Inc.,Liquidity Services,Retail - Apparel & Specialty,"Liquidity Service Inc is an online auction marketplace for surplus and salvage assets. It enables buyers and sellers to transact in an efficient, automated online auction environment offering over approximately 500 product categories.",https://www.liquidityservices.com,LQDT.png,William P. Angrick,Nasdaq Global Select,276835358,Consumer Cyclical,Consumer Cyclical,Specialty Retail,Retail - Apparel & Specialty 
BNED,Barnes & Noble Education Inc,Barnes & Noble Education,Retail - Apparel & Specialty,"Barnes & Noble Education, Inc. operates bookstores for college and university campuses in the United States. It also provides digital education services for enhancing the academic and social purpose of educational institutions.",http://www.bned.com,BNED.png,Michael P. Huseby,New York Stock Exchange,272998200,Consumer Cyclical,Consumer Cyclical,Specialty Retail,Retail - Apparel & Specialty 
PCMI,PCM Inc.,PCM,Retail - Apparel & Specialty,PCM Inc operates as a multi-vendor provider of technology products and solutions primarily in the United States and Canada.,http://www.pcm.com,PCMI.png,Frank F. Khulusi,NASDAQ Global Market,267929682,Consumer Cyclical,Consumer Cyclical,Specialty Retail,Retail - Apparel & Specialty 
APRN,Blue Apron Holdings Inc. Class A,Blue Apron,Retail - Apparel & Specialty,"Blue Apron Holdings Inc creates original recipes, which are sent along with fresh, seasonal ingredients, directly to customers for them to prepare, cook, and enjoy.",http://www.blueapron.com,APRN.png,Bradley J. Dickerson,New York Stock Exchange,267373180,Consumer Cyclical,Consumer Cyclical,Specialty Retail,Retail - Apparel & Specialty 
JILL,J. Jill Inc.,J. Jill,Retail - Apparel & Specialty,"J.Jill Inc owns and operates women's clothing stores. Its brand portfolio comprises of J.Jill, The J.Jill Wearever Collection and Pure Jill under which it sells jackets, sweaters, knit tops and tees.",http://www.jjill.com,JILL.png,Linda Heasley,New York Stock Exchange,261174109,Consumer Cyclical,Consumer Cyclical,Apparel Stores,Retail - Apparel & Specialty 
CTRN,Citi Trends Inc.,Citi Trends,Retail - Apparel & Specialty,"Citi Trends Inc is a retailer of urban fashion apparel and accessories for the entire family. The Company's merchandise offerings are designed to appeal to the preferences of fashion conscious consumers, particularly African-Americans.",http://www.cititrends.com,CTRN.png,Bruce D. Smith,Nasdaq Global Select,250954000,Consumer Cyclical,Consumer Cyclical,Apparel Stores,Retail - Apparel & Specialty 
RTW,RTW Retailwinds Inc.,RTW Retailwinds,Retail - Apparel & Specialty,"New York & Co Inc together with its subsidiaries is a specialty retailer of women's fashion apparel & accessories & the modern wear-to-work destination for women. It provides fitting pants & NY Style that is feminine, polished, on-trend & versatile.",http://www.nyandcompany.com,RTW.png,Gregory Scott,New York Stock Exchange,216946672,Consumer Cyclical,Consumer Cyclical,Apparel Stores,Retail - Apparel & Specialty 
GAIA,Gaia Inc.,Gaia,Retail - Apparel & Specialty,"Gaia Inc along with its subsidiaries provides yoga, fitness & wellness products with media, subscription & travel services to customers who value personal development, wellness, ecological lifestyles, responsible media & conscious community.",http://www.gaia.com,,Jirka Rysavy,NASDAQ Global Market,207462611,Consumer Cyclical,Consumer Cyclical,Specialty Retail,Retail - Apparel & Specialty 
TA,TravelCenters of America LLC,TravelCenters of America LLC,Retail - Apparel & Specialty,"TravelCenters of America LLC operates and franchise travel centers, standalone convenience stores, and standalone restaurants. It collects rents, royalties and other fees from our tenants and franchisees.",https://www.ta-petro.com,,Andrew J. Rebholz,Nasdaq Global Select,203215068,Consumer Cyclical,Consumer Cyclical,Specialty Retail,Retail - Apparel & Specialty 
KIRK,Kirkland's Inc.,Kirkland's,Retail - Apparel & Specialty,"Kirkland's Inc is a retailer of home decor and gifts. Its stores present a selection of distinctive merchandise, including framed art, mirrors, wall decor, candles & related items, lamps, decorative accessories, accent furniture, textiles & among others.",http://www.kirklands.com,KIRK.png,Steven C. Woodward,Nasdaq Global Select,154674226,Consumer Cyclical,Consumer Cyclical,Specialty Retail,Retail - Apparel & Specialty 
DXLG,Destination XL Group Inc.,Destination XL,Retail - Apparel & Specialty,"Destination XL Group Inc is a retailer of men's clothing. It operates through brands like Polo, Reebok, Oak Hill, Robert Graham, Lacoste, Levi's and True Nation.",http://www.destinationxl.com,,,Nasdaq Global Select,126170988,Consumer Cyclical,Consumer Cyclical,Apparel Stores,Retail - Apparel & Specialty 
VSI,Vitamin Shoppe Inc,Vitamin Shoppe,Retail - Apparel & Specialty,"Vitamin Shoppe Inc is a specialty retailer and contract manufacturer of nutritional products. It offers vitamins, minerals, specialty supplements, herbs, sports nutrition, under brands such as The Vitamin Shoppe, BodyTech, True Athlete, and MyTrition.",http://www.vitaminshoppe.com,VSI.png,Sharon M. Leite,New York Stock Exchange,119140668,Consumer Cyclical,Consumer Cyclical,Specialty Retail,Retail - Apparel & Specialty 
RMBL,RumbleOn Inc.,RumbleOn,Retail - Apparel & Specialty,"RumbleON Inc is an online retailer which allows consumers and dealers to buy, sell and trade pre-owned motorcycles. It provides cash offers for the purchase of vehicles and flexibility to trade, list, and auction vehicle through website and application.",http://www.rumbleon.com,,Marshall Chesrown,NASDAQ Capital Market,117088965,Consumer Cyclical,Consumer Cyclical,Specialty Retail,Retail - Apparel & Specialty 
NETS,Netshoes (Cayman) Limited,Netshoes (Cayman) Limited,Retail - Apparel & Specialty,"Netshoes (Cayman) Ltd is a holding company. The Company through its subsidiaries offers sports and lifestyle products athletic shoes, jerseys, apparel, accessories & sporting equipment from international, local and private brands as well as fashion.",http://www.netshoes.com.br,NETS.png,Marcio Kumruian,New York Stock Exchange,87733889,Consumer Cyclical,Consumer Cyclical,Specialty Retail,Retail - Apparel & Specialty 
CSS,CSS Industries Inc.,CSS Industries,Retail - Apparel & Specialty,"CSS Industries Inc is a consumer products company. It is engaged in the design, manufacture, procurement, distribution and sale of seasonal and all occasion social expression products to mass market retailers.",http://www.cssindustries.com,CSS.png,Christopher J. Munyan,New York Stock Exchange,78904587,Consumer Cyclical,Consumer Cyclical,Specialty Retail,Retail - Apparel & Specialty 
BBW,Build-A-Bear Workshop Inc.,Build-A-Bear Workshop,Retail - Apparel & Specialty,"Build-A-Bear Workshop Inc is a specialty retailer which offers ""make your own stuffed animal"" interactive entertainment experience in which guests visit a variety of stations to make and customize a stuffed animal.",http://www.buildabear.com,BBW.png,Sharon Price John,New York Stock Exchange,77174116,Consumer Cyclical,Consumer Cyclical,Specialty Retail,Retail - Apparel & Specialty 
BGFV,Big 5 Sporting Goods Corporation,Big 5 Sporting Goods,Retail - Apparel & Specialty,"Big 5 Sporting Goods Corp is a sporting goods retailer. Products include athletic shoes, apparel & accessories, outdoor & athletic equipment for team sports, fitness, camping, hunting, fishing, tennis, golf, winter & summer recreation & roller sports.",http://www.big5sportinggoods.com,BGFV.png,Steven G. Miller,Nasdaq Global Select,77141786,Consumer Cyclical,Consumer Cyclical,Specialty Retail,Retail - Apparel & Specialty 
PIR,Pier 1 Imports Inc.,Pier 1 Imports,Retail - Apparel & Specialty,"Pier 1 Imports Inc acts as a retailer of decorative accessories, furniture, candles, homeware, gifts and seasonal products. It operates through retail stores and an e-commerce website under the brand Pier 1 Imports.",http://www.pier1.com,PIR.png,Cheryl A. Bachelder,New York Stock Exchange,69535224,Consumer Cyclical,Consumer Cyclical,Specialty Retail,Retail - Apparel & Specialty 
ATV,Acorn International Inc. ADS,Acorn International ADS,Retail - Apparel & Specialty,"Acorn International Inc is a marketing and branding company. It is engaged in developing, promoting and selling a diverse portfolio of proprietary-branded products, as well as well-established and promising new products from third parties.",http://www.acorninternationalir.com,,Jacob A. Fisch,New York Stock Exchange,68428798,Consumer Cyclical,Consumer Cyclical,Specialty Retail,Retail - Apparel & Specialty 
JMU,JMU Limited,JMU Limited,Retail - Apparel & Specialty,"JMU Ltd offers online platform for providing B2B services to food-industry suppliers and customers in China. It offers products through online direct sales and online marketplace. Its products include food ingredients, seasonings, furniture and other.",http://www.ccjoin.com,,Xiaoxia Zhu,NASDAQ Global Market,62290776,Consumer Cyclical,Consumer Cyclical,Specialty Retail,Retail - Apparel & Specialty 
FTD,FTD Companies Inc.,FTD Companies,Retail - Apparel & Specialty,"FTD Companies Inc is a floral and gifting company. The company provides floral, specialty foods, gift and related products and services to consumers, retail florists, and other retail locations and companies in need of floral and gifting solutions.",http://www.ftd.com,,Scott D. Levin,Nasdaq Global Select,62093537,Consumer Cyclical,Consumer Cyclical,Specialty Retail,Retail - Apparel & Specialty 
SMRT,Stein Mart Inc.,Stein Mart,Retail - Apparel & Specialty,"Stein Mart Inc operates several hundred department stores in the United States. It is engaged in providing fashion merchandise, service and presentation of a department or specialty store at prices competitive with off-price retail chains.",http://www.steinmart.com,,David Hunt Hawkins,Nasdaq Global Select,54305707,Consumer Cyclical,Consumer Cyclical,Apparel Stores,Retail - Apparel & Specialty 
LITB,LightInTheBox Holding Co. Ltd. American Depositary Shares each representing 2,LightInTheBox Holding Co. American Depositary Shares each representing 2,Retail - Apparel & Specialty,"LightInTheBox Holding Co Ltd is an online retail company delivering products directly to consumers around the world. It provides apparel products including customized, special occasion, and fast fashion apparel products.",http://www.lightinthebox.com,LITB.png,Quji (Alan) Guo,New York Stock Exchange,50854330,Consumer Cyclical,Consumer Cyclical,Specialty Retail,Retail - Apparel & Specialty 
