ticker,company name,short name,industry,description,website,logo,ceo,exchange,market cap,sector,tag 1,tag 2,tag 3 
MT,Arcelor Mittal NY Registry Shares NEW,Arcelor Mittal NY Registry Shares NEW,Steel,"ArcelorMittal SA is an integrated steel and mining company. The company produces diversified portfolio of iron ore and coal assets as well as steel flat products, including sheet and plate, and long products, including bars, rods and structural shapes.",http://www.arcelormittal.com,MT.png,Lakshmi Niwas Mittal,New York Stock Exchange,23919032021,Basic Materials,Basic Materials,Steel, 
PKX,POSCO,POSCO,Steel,POSCO is the producer of steel in Korea. The company is engaged in the manufacturing and distribution of steel rolled products and plates in the domestic and overseas markets.,http://www.posco.com,PKX.png,Oh-Joon Kwon,New York Stock Exchange,19400803625,Basic Materials,Basic Materials,Steel, 
NUE,Nucor Corporation,Nucor,Steel,Nucor Corp and its affiliates are engaged in the manufacturing of steel and steel products. It also produces direct reduced iron for use in the steel mills. The company is involved in every phase of the steelmaking.,http://www.nucor.com,,John J. Ferriola,New York Stock Exchange,18723560570,Basic Materials,Basic Materials,Steel, 
STLD,Steel Dynamics Inc.,Steel Dynamics,Steel,"Steel Dynamics Inc is a steel producers and metal recycler in the United States. The company produces steel sheet products, long products and steel finishing products. It also operates metals recycling and steel fabrication business.",http://www.steeldynamics.com,STLD.png,Mark D. Millett,Nasdaq Global Select,8502614451,Basic Materials,Basic Materials,Steel, 
GGB,Gerdau S.A.,Gerdau S.A.,Steel,"Gerdau SA is engaged in the production and commercialization of steel products. The company's mills located in Argentina, Brazil, Canada, Chile, Colombia, the United States, India, Mexico, Peru, among others.",http://www.gerdau.com,GGB.png,Gustavo Werneck da Cunha,New York Stock Exchange,7336204475,Basic Materials,Basic Materials,Steel, 
TX,Ternium S.A. American Depositary Shares (each representing ten shares USD1.00 par value),Ternium S.A. American Depositary Shares (each representing ten shares USD1.00 par value),Steel,"Ternium SA is a producer of steel products. It is engaged in manufacturing and processing of flat and long steel products for construction, home appliances, capital goods, container, food, energy and automotive industries.",http://www.ternium.com,TX.png,Maximo Vedoya,New York Stock Exchange,5987384149,Basic Materials,Basic Materials,Steel, 
RS,Reliance Steel & Aluminum Co. (DE),Reliance Steel & Aluminum Co. (DE),Steel,"Reliance Steel & Aluminum Co is engaged in providing metal processing and inventory management services for carbon and stainless steel, aluminum, alloys, brass and copper, and titanium.",http://www.rsac.com,RS.png,James D. Hoffman,New York Stock Exchange,5858537586,Basic Materials,Basic Materials,Steel, 
X,United States Steel Corporation,United States Steel,Steel,"United States Steel Corp is an integrated steel producer. Its products include flat-rolled and tubular products with production operations in North America and Europe. Its products cater to automotive, construction and energy companies.",http://www.ussteel.com,X.png,David B. Burritt,New York Stock Exchange,3965414000,Basic Materials,Basic Materials,Steel, 
SID,Companhia Siderurgica Nacional S.A.,Companhia Siderurgica Nacional S.A.,Steel,"Companhia Siderurgica Nacional is an integrated steel producer. The company operates in five segments namely, Steel, Mining, Logistics, Energy and Cement.",http://www.csn.com.br,SID.png,Benjamin Steinbruch,New York Stock Exchange,3664204122,Basic Materials,Basic Materials,Steel, 
WOR,Worthington Industries Inc.,Worthington Industries,Steel,"Worthington Industries Inc is metals manufacturing company. Its products are pressure cylinders for liquefied petroleum gas, compressed natural gas, oxygen, cylinders, helium-filled balloon kits, steel and fiberglass tanks and processing equipment.",http://www.worthingtonindustries.com,WOR.png,John P. Mcconnell,New York Stock Exchange,2158786243,Basic Materials,Basic Materials,Steel, 
CMC,Commercial Metals Company,Commercial Metals Company,Steel,"Commercial Metals Co manufactures, recycles and markets steel and metal products and related materials and services. Its products and services include metal recycling, mill products, fabrication,construction products etc.",https://www.cmc.com,CMC.png,Barbara R. Smith,New York Stock Exchange,2064568188,Basic Materials,Basic Materials,Steel, 
SIM,Grupo Simec S.A.B. de C.V. American Depositary Shares,Grupo Simec S.A.B. de C.V. American Depositary Shares,Steel,"Grupo Simec SAB de CV is a diversified manufacturer, processor and distributor of SBQ steel and structural steel products. It also offers hot rolled bars, cold finished bars, semi-finished tube rounds and other semi-finished trade products.",http://www.gsimec.com.mx,,Luis Garcia Limon,NYSE American,1548715356,Basic Materials,Basic Materials,Steel, 
AKS,AK Steel Holding Corporation,AK Steel Holding,Steel,"AK Steel Holding Corp is engaged in manufacturing steel products such as flat-rolled, carbon, electrical, and stainless steel as well as tubular products for the automotive, construction, appliance, and machinery end markets.",http://www.aksteel.com,AKS.png,Roger K. Newport,New York Stock Exchange,946607295,Basic Materials,Basic Materials,Steel, 
SCHN,Schnitzer Steel Industries Inc.,Schnitzer Steel Industries,Steel,"Schnitzer Steel Industries Inc is a ferrous and non-ferrous scrap metal recycler and manufacturer of finished steel products in the US. Its metal recycling business collects and recycles auto bodies, rail cars, appliances, machinery etc.",http://www.schnitzersteel.com,SCHN.png,Tamara L. Lundgren,Nasdaq Global Select,651196699,Basic Materials,Basic Materials,Steel, 
MTL,Mechel PAO American Depositary Shares (Each rep. 1),Mechel PAO American Depositary Shares (Each rep. 1),Steel,"Mechel PAO is engaged in production and sale of coal, coke and chemical products, iron ore and limestone, semi-finished steel products and supplies electricity and heat energy to its group companies and external customers.",http://www.mechel.com,MTL.png,Oleg V. Korzhov,New York Stock Exchange,601927497,Basic Materials,Basic Materials,Steel, 
TMST,TimkenSteel Corporation,TimkenSteel,Steel,"TimkenSteel Corp is the United States based manufacturer of alloy steel and carbon and micro-alloy steel. The company's portfolio includes SBQ bars, seamless mechanical tubing, and precision steel components.",http://www.timkensteel.com,TMST.png,Ward J. Timken,New York Stock Exchange,551066496,Basic Materials,Basic Materials,Steel, 
ZEUS,Olympic Steel Inc.,Olympic Steel,Steel,"Olympic Steel Inc is a metal services center in U.S. The company is engaged in the processing and distribution of carbon, coated, aluminum and stainless steel, flat-rolled coil, sheet and plate products and tubular and pipe products to various industries.",http://www.olysteel.com,ZEUS.png,Richard T. Marabito,Nasdaq Global Select,214113361,Basic Materials,Basic Materials,Steel, 
USAP,Universal Stainless & Alloy Products Inc.,Universal Stainless & Alloy Products,Steel,"Universal Stainless & Alloy Products Inc and its subsidiaries, manufactures and markets semi-finished and finished specialty steel products. It offers stainless steel, nickel alloys, tool steel and certain other premium alloyed steels.",http://www.univstainless.com,,Dennis M. Oates,Nasdaq Global Select,159929067,Basic Materials,Basic Materials,Steel, 
SYNL,Synalloy Corporation,Synalloy,Steel,"Synalloy Corp manufactures dyes, metal pipes and systems, fiberglass, and steel tanks. Its products are widely used in the chemical, paper, mining, textiles and liquefied natural gas industries.",http://www.synalloy.com,,Craig C. Bram,NASDAQ Global Market,140605160,Basic Materials,Basic Materials,Steel, 
FRD,Friedman Industries Inc.,Friedman Industries,Steel,"Friedman Industries Inc is engaged in steel processing, pipe manufacturing and processing and steel and pipe distribution. The Company has two product groups coil and tubular products.",http://www.friedmanindustries.com,,Robert Sparkman,NYSE American,53552152,Basic Materials,Basic Materials,Steel, 
ZKIN,ZK International Group Co. Ltd,ZK International Co.,Steel,"ZK International Group Co Ltd is engaged in designing and producing pipes and fittings such as double-press thin-walled stainless steel tubes and fittings, carbon steel tubes and fittings and single-press tubes and fittings.",http://www.chinazhengkang.com,ZKIN.png,Jiancong Huang,NASDAQ Capital Market,26724672,Basic Materials,Basic Materials,Steel, 
OSN,Ossen Innovation Co. Ltd.,Ossen Innovation Co.,Steel,"Ossen Innovation Co Ltd, formerly known as San Meditech Holdings Ltd designs, manufactures, sells and markets customised prestressed concrete materials. Its materials are used in construction of bridges, highways & other infrastructure projects.",http://www.osseninnovation.com,,Wei Hua,NASDAQ Capital Market,11808694,Basic Materials,Basic Materials,Steel, 
